{
  "id": "example-synthetic-hardware-check",
  "title": "Synthetic hardware seller check",
  "source": {
    "url": "https://example.com/public-request",
    "author": "synthetic-author",
    "published_at": "2026-01-01T00:00:00Z",
    "date_precision": "exact",
    "verification_method": "Synthetic example; not a real lead"
  },
  "need_summary": "A synthetic buyer wants a narrow check of a Chinese seller.",
  "china_dependency": "The requested seller and marketplace are in China.",
  "founder_fit_score": 0,
  "relevant_founder_strengths": ["research", "communication", "honesty"],
  "why_me_for_this_lead": "I can structure the questions and return an evidence table.",
  "do_not_mention": ["Unverified supplier relationships", "certification expertise"],
  "trust_barriers": ["The seller's manufacturing status is unknown"],
  "suggested_trust_signal": "Return original answers and separate facts from assumptions.",
  "first_small_task": "Check one seller's identity, product model and stated return terms.",
  "proof_needed": ["Original seller page", "Timestamped responses"],
  "relationship_expansion_path": ["Seller check", "Sample coordination"],
  "recommended_contact_channel": "Source platform first",
  "when_to_offer_wechat": "Only after the buyer asks or agrees to move the conversation.",
  "when_to_offer_telegram": "Only after the buyer asks or agrees to move the conversation.",
  "first_reply": "You are trying to reduce the risk of buying from a seller whose real capability is unclear. I would start with one seller and check the exact model, seller history, condition and return terms, then report the original answers and the points that remain unverified. Would that narrow check be useful?",
  "reply_plan": "Confirm the product, destination, deadline and acceptance criteria before any quote.",
  "pricing_model": "A fixed fee for one bounded check, proposed only after scope is confirmed.",
  "freshness_assessment": "Synthetic example.",
  "next_checks": ["Replace with a real public request", "Confirm platform contact rules"],
  "evidence_ids": ["example-evidence-001"],
  "required_credentials": [],
  "overseas_status": "confirmed",
  "current_need_status": "confirmed_active",
  "contact_permission": "verified_allowed",
  "disposition": "prioritize",
  "milestone": "DISCOVERED",
  "risks": ["Synthetic data must never be treated as a real opportunity"]
}
